[
  {
    "id": "a7b452fe-179e-49b7-b44b-a90e044850c3",
    "schema_version": "1.0.0",
    "idempotency_key": "fixture-product-1-create",
    "status": "DRAFT",
    "version": 1,
    "created_at": "2026-07-31T09:00:00Z",
    "updated_at": "2026-07-31T09:00:00Z",
    "created_by_role": "PHASE_OWNER",
    "name": "fixture-product-name-1",
    "description": "fixture-product-description-1: a structural placeholder, not a real RDBC offering.",
    "pricing_approval_id": null
  },
  {
    "id": "5907a1a4-3740-4675-9079-e59e9eb91c8e",
    "schema_version": "1.0.0",
    "idempotency_key": "fixture-product-2-create",
    "status": "ACTIVE",
    "version": 2,
    "created_at": "2026-07-31T09:05:00Z",
    "updated_at": "2026-07-31T10:00:00Z",
    "created_by_role": "SPECIALIST",
    "name": "fixture-product-name-2",
    "description": "fixture-product-description-2: a structural placeholder, not a real RDBC offering.",
    "pricing_approval_id": null
  }
]
